{
  "conversation_id": "13131313-1313-4313-8313-131313131313",
  "revision": 1,
  "title": "Practice",
  "subject": {
    "model_id": "12121212-1212-4212-8212-121212121212",
    "adapter_checkpoint_id": "10101010-1010-4010-8010-101010101010"
  },
  "turns": [],
  "created_at": "2026-09-28T12:00:00.000Z",
  "updated_at": "2026-09-28T12:00:00.000Z",
  "origin": "locally_created"
}
